number,value,datetime_start,datetime_complete,duration,params_add_l1,params_batch_size,params_conv1_channels,params_conv2_channels,params_criterion,params_dropout,params_epochs,params_fc_size,params_kernel_size_conv1,params_lambda_l1,params_lr,params_use_batch_norm,user_attrs_mean_accuracy,user_attrs_std_accuracy,state
0,0.6677801418439717,2024-10-31 14:37:49.138150,2024-10-31 14:41:56.729026,0 days 00:04:07.590876,False,128,32,64,cross_entropy,0.43039825342432053,47,128,5,0.0,2.8054601441577588e-05,False,0.6677801418439717,0.04350279679581412,COMPLETE
1,0.7055574712643679,2024-10-31 14:41:56.740717,2024-10-31 14:45:09.429821,0 days 00:03:12.689104,True,128,64,128,cross_entropy,0.17733435395260522,29,64,2,1.9014916801350306e-05,0.00022293880957537354,False,0.7055574712643679,0.04576457278661222,COMPLETE
2,0.7581034482758618,2024-10-31 14:45:09.440315,2024-10-31 14:49:04.894223,0 days 00:03:55.453908,False,64,32,128,cross_entropy,0.2898630776683725,29,128,5,0.0,0.00020887143925250152,False,0.7581034482758618,0.06280796026911609,COMPLETE
4,0.772712643678161,2024-10-31 14:53:35.099476,2024-10-31 14:57:08.328690,0 days 00:03:33.229214,False,128,64,64,nf_land_rce,0.10330274730257508,29,64,3,0.0,0.0009536536530709598,True,0.772712643678161,0.05959304673741516,COMPLETE
5,0.3469880952380952,2024-10-31 14:57:08.340828,2024-10-31 15:08:36.337853,0 days 00:11:27.997025,False,32,64,64,cross_entropy,0.4976928643440897,49,256,5,0.0,0.004006172567258268,True,0.3469880952380952,0.030785290756855408,COMPLETE
6,0.7122942708333332,2024-10-31 15:08:36.350497,2024-10-31 15:16:05.715580,0 days 00:07:29.365083,False,64,64,256,cross_entropy,0.15626229531736824,32,256,4,0.0,3.451659818642591e-05,False,0.7122942708333332,0.05063023371598222,COMPLETE
7,0.24922222222222226,2024-10-31 15:16:05.726985,2024-10-31 15:22:02.423542,0 days 00:05:56.696557,True,32,64,128,cross_entropy,0.4344053757862383,21,128,5,2.0509371742967548e-05,0.004088769380872157,False,0.24922222222222226,0.011906723383382813,COMPLETE
8,0.7165133333333333,2024-10-31 15:22:02.436154,2024-10-31 15:26:54.255433,0 days 00:04:51.819279,True,64,64,64,nf_land_rce,0.2942874949632521,25,64,2,7.232339959203363e-05,2.1243768488853784e-05,True,0.7165133333333333,0.05078577381730264,COMPLETE
9,0.6926,2024-10-31 15:26:54.265946,2024-10-31 15:30:42.386525,0 days 00:03:48.120579,True,64,32,256,nf_land_rce,0.45007761565291665,20,128,4,3.6998761560836746e-05,0.0008285782023054468,False,0.6926,0.0447121860719573,COMPLETE
10,0.6715277777777776,2024-10-31 15:30:42.407127,2024-10-31 15:34:41.651997,0 days 00:03:59.244870,True,128,32,128,nf_land_rce,0.27679270552440965,33,256,3,0.0007231134383579543,0.002435810256101544,True,0.6715277777777776,0.02121855632307405,COMPLETE
11,0.7853882113821138,2024-10-31 15:34:41.663713,2024-10-31 15:42:25.743301,0 days 00:07:44.079588,False,128,128,64,nf_land_rce,0.11156181592954598,41,64,3,0.0,0.0007894945933638116,True,0.7853882113821138,0.059409964700746415,COMPLETE
12,0.7906829268292683,2024-10-31 15:42:25.754872,2024-10-31 15:50:10.483267,0 days 00:07:44.728395,False,128,128,64,nf_land_rce,0.11041956822175163,41,64,3,0.0,0.0007770430685879307,True,0.7906829268292683,0.06331744350174186,COMPLETE
13,0.7914444444444444,2024-10-31 15:50:10.494681,2024-10-31 15:58:04.419199,0 days 00:07:53.924518,False,128,128,64,nf_land_rce,0.20378315365867722,42,64,3,0.0,0.0006693778483483631,True,0.7914444444444444,0.06008283707021203,COMPLETE
14,0.7946626016260164,2024-10-31 15:58:04.429346,2024-10-31 16:05:20.688275,0 days 00:07:16.258929,False,128,128,64,nf_land_rce,0.20227342946154778,41,64,3,0.0,8.990258089421415e-05,True,0.7946626016260164,0.06623690224676726,COMPLETE
15,0.7771709401709399,2024-10-31 16:05:20.698329,2024-10-31 16:12:15.763444,0 days 00:06:55.065115,False,128,128,64,nf_land_rce,0.21522605810265116,39,64,3,0.0,9.478504781303849e-05,True,0.7771709401709399,0.06370072798069049,COMPLETE
16,0.7821870370370371,2024-10-31 16:12:15.774036,2024-10-31 16:20:14.425646,0 days 00:07:58.651610,False,128,128,64,nf_land_rce,0.21943543893838383,45,64,3,0.0,9.177533613310894e-05,True,0.7821870370370371,0.05727905795410517,COMPLETE
17,0.2930961538461539,2024-10-31 16:20:14.436364,2024-10-31 16:33:40.437897,0 days 00:13:26.001533,False,32,128,256,nf_land_rce,0.34388518833814197,39,64,3,0.0,0.00950422142768644,True,0.2930961538461539,0.03572281475127778,COMPLETE
18,0.7202651515151515,2024-10-31 16:33:40.450322,2024-10-31 16:41:28.118078,0 days 00:07:47.667756,False,128,128,64,nf_land_rce,0.23079974274370926,44,64,3,0.0,1.1451703093959299e-05,True,0.7202651515151515,0.05750162018119047,COMPLETE
19,0.7760462962962963,2024-10-31 16:41:28.128294,2024-10-31 16:47:36.732075,0 days 00:06:08.603781,False,128,128,64,nf_land_rce,0.347789145899377,36,64,2,0.0,9.870339977133137e-05,True,0.7760462962962963,0.05327178684181352,COMPLETE
20,0.6571666666666668,2024-10-31 16:47:36.742618,2024-10-31 17:04:10.633730,0 days 00:16:33.891112,False,32,128,256,nf_land_rce,0.16702376247302336,37,256,4,0.0,0.00042219166710874887,True,0.6571666666666668,0.03265598970577471,COMPLETE
21,0.7813166666666667,2024-10-31 17:04:10.646923,2024-10-31 17:13:09.053566,0 days 00:08:58.406643,False,128,128,64,nf_land_rce,0.2517585756181259,50,64,3,0.0,5.103345238242022e-05,True,0.7813166666666667,0.06370738226889844,COMPLETE
22,0.7923650793650794,2024-10-31 17:13:09.065716,2024-10-31 17:20:41.188477,0 days 00:07:32.122761,False,128,128,64,nf_land_rce,0.14100687855417912,42,64,3,0.0,0.0004489330090252505,True,0.7923650793650794,0.0624359008668666,COMPLETE
23,0.7908081395348837,2024-10-31 17:20:41.199560,2024-10-31 17:28:26.123450,0 days 00:07:44.923890,False,128,128,64,nf_land_rce,0.17508475192192802,43,64,3,0.0,0.0003870703059573136,True,0.7908081395348837,0.06688419582234831,COMPLETE
24,0.7350634057971014,2024-10-31 17:28:26.138560,2024-10-31 17:36:37.079352,0 days 00:08:10.940792,False,128,128,64,nf_land_rce,0.13853310960088375,46,64,3,0.0,0.0019808650191064977,True,0.7350634057971014,0.04860613351432245,COMPLETE
25,0.7854126984126983,2024-10-31 17:36:37.093902,2024-10-31 17:44:03.694213,0 days 00:07:26.600311,False,128,128,64,nf_land_rce,0.19726113456163036,42,64,3,0.0,0.00020403713486800672,True,0.7854126984126983,0.06373778530242678,COMPLETE
26,0.7875961538461538,2024-10-31 17:44:03.704668,2024-10-31 17:50:58.623993,0 days 00:06:54.919325,False,128,128,64,nf_land_rce,0.3335197969715894,39,64,3,0.0,0.0004302617511325013,True,0.7875961538461538,0.06287558810241214,COMPLETE
27,0.6539237588652482,2024-10-31 17:50:58.635285,2024-10-31 17:59:28.010559,0 days 00:08:29.375274,True,128,128,64,nf_land_rce,0.13888893091749013,47,64,3,0.008483424013584191,0.0001340078226976447,True,0.6539237588652482,0.026556191983781154,COMPLETE
28,0.771014705882353,2024-10-31 17:59:28.021086,2024-10-31 18:06:25.038690,0 days 00:06:57.017604,False,128,128,64,nf_land_rce,0.25275361497949306,34,64,4,0.0,5.5294545910358066e-05,True,0.771014705882353,0.0652946829157655,COMPLETE
29,0.36468468468468457,2024-10-31 18:06:25.050680,2024-10-31 18:19:11.145367,0 days 00:12:46.094687,False,32,128,256,nf_land_rce,0.18582774398042012,37,256,2,0.0,0.001307961933221718,True,0.36468468468468457,0.02000891444664124,COMPLETE
30,0.7775590277777777,2024-10-31 18:19:11.156997,2024-10-31 18:25:38.647250,0 days 00:06:27.490253,False,64,32,128,cross_entropy,0.13360047112525977,48,128,5,0.0,0.0005382354060430664,False,0.7775590277777777,0.06845470665296632,COMPLETE
31,0.7973977272727272,2024-10-31 18:25:38.658314,2024-10-31 18:33:29.995441,0 days 00:07:51.337127,False,128,128,64,nf_land_rce,0.25720289911166416,44,128,3,0.0,0.0002529819282040766,True,0.7973977272727272,0.06596318672115886,COMPLETE
32,0.7962594696969698,2024-10-31 18:33:30.006455,2024-10-31 18:41:21.293618,0 days 00:07:51.287163,False,128,128,64,nf_land_rce,0.2540784239473116,44,128,3,0.0,0.00015483494497033802,True,0.7962594696969698,0.07319499308421011,COMPLETE
33,0.7968617424242423,2024-10-31 18:41:21.305068,2024-10-31 18:49:12.223430,0 days 00:07:50.918362,False,128,128,64,nf_land_rce,0.26352907320227736,44,128,3,0.0,0.0002817249690005036,True,0.7968617424242423,0.0691158811892753,COMPLETE
34,0.7931287878787879,2024-10-31 18:49:12.233709,2024-10-31 18:57:03.280227,0 days 00:07:51.046518,False,128,128,64,nf_land_rce,0.2603581957517096,44,128,3,0.0,0.00022986473223712988,True,0.7931287878787879,0.06109871146325555,COMPLETE
35,0.7218242753623189,2024-10-31 18:57:03.291832,2024-10-31 19:00:48.489338,0 days 00:03:45.197506,False,128,32,64,cross_entropy,0.3264490730134513,46,128,3,0.0,0.0001460584004627121,False,0.7218242753623189,0.050722545667263724,COMPLETE
36,0.8095746527777777,2024-10-31 19:00:48.499654,2024-10-31 19:10:05.917015,0 days 00:09:17.417361,False,128,128,128,nf_land_rce,0.24209237900577477,48,128,2,0.0,0.00023746676972336207,True,0.8095746527777777,0.06545455431392833,COMPLETE
37,0.703725,2024-10-31 19:10:05.928069,2024-10-31 19:19:53.636650,0 days 00:09:47.708581,True,128,128,128,cross_entropy,0.3123612282269492,50,128,2,0.0008707134144739248,0.00026418498038228587,True,0.703725,0.022210634652496238,COMPLETE
